kod;aciklama
F.8.4.4.1;Asit ve bazların genel özelliklerini ifade eder.
F.8.4.4.2;Asit ve bazlara günlük yaşamdan örnekler verir.
F.8.4.4.3;Günlük hayatta ulaşılabilecek malzemeleri asit-baz ayracı olarak kullanır.
F.8.4.4.4;Maddelerin asitlik ve bazlık durumlarına ilişkin pH değerlerini kullanarak çıkarımda bulunur.
F.8.4.4.5;Asit ve bazların çeşitli maddeler üzerindeki etkilerini gözlemler.
F.8.4.4.6;Asit ve bazların temizlik malzemesi olarak kullanılması esnasında oluşabilecek tehlikelerle ilgili gerekli tedbirleri alır.
F.8.4.4.7;Asit yağmurlarının önlenmesine yönelik çözüm önerileri sunar.
